,Title,Date,Project Center,Location,Subject Terms,Link,Alternative Link,Advisors,Initials,Notes,Link to summary,Goal,Stakeholders,Impact,Headline,Follow-up,Category,Sub_Category
39,Stem Program For The Boys & Girls Club Of Worcester,Dec-15,Worcester Community Project Center,"Worcester, MA",Science--study And Teaching | Engineering--study And Teaching,https://wpi.primo.exlibrisgroup.com/discovery/fulldisplay?context=L&vid=01WPI_INST:Default&search_scope=studentWorks&tab=https:%2F%2Fwpi.primo.exlibrisgroup.com%2Fpermalink%2F01WPI_INST%2F12krsei%2Falma9936833025704746&docid=alma9936833025704746&lang=en,https://digitalcommons.wpi.edu/cgi/viewcontent.cgi?article=1595&context=iqp-all,"Dehner, Corey | Belz, Melissa",CS,,https://docs.google.com/document/d/13w8Q3DFKCRSka6d1uZWNmlt1xS-KF1hyObAdY9nW9Sk/edit?usp=sharing,"Develop and prototype an engaging educational program, which would allow the Boys & Girls Club of Worcester to effectively and consistently introduce its 10-13 year old members to STEM","Boys & Girls Club of Worcester (BGCW), boys and girls at BGCW","Parental, cultural, religious  influences may dictate not only the interest level of the student regarding STEM, but also children’s ability to foresee themselves in specific STEM careers",STEM ed for the Boys & Girls Club of Worcester,,Education,Stem
40,Boys And Girls Club Iqp,Mar-19,On-campus,"Worcester, MA",Science--study And Teaching,https://wpi.primo.exlibrisgroup.com/discovery/fulldisplay?context=L&vid=01WPI_INST:Default&search_scope=studentWorks&tab=https:%2F%2Fwpi.primo.exlibrisgroup.com%2Fpermalink%2F01WPI_INST%2F12krsei%2Falma9936869295604746&docid=alma9936869295604746&lang=en,https://digitalcommons.wpi.edu/cgi/viewcontent.cgi?article=6316&context=iqp-all,"Elmes, Katie | Chen, Katherine ",CS,Visually pleasing report,https://docs.google.com/document/d/1ZTzwuAC6VsYvPGMJOvAefXxmBgsWxanCTlDk1bgdnK4/edit?usp=sharing,To help students and families learn about digital citizenship and internet safety; to help students increase their Microsoft Office program skill sets,Boys and Girls Club of Worcester,Understanding and awareness of digital citizenship and Microsoft Office programs were improved,Digital citizenship with the Boys & Girls Club,,Education,Stem
41,Developing A Steam Strategy For The Boys & Girls Club Of Worcester,05-01-18,Worcester Community Project Center,"Worcester, MA",Curriculum Planning,https://wpi.primo.exlibrisgroup.com/discovery/fulldisplay?context=L&vid=01WPI_INST:Default&search_scope=studentWorks&tab=https:%2F%2Fwpi.primo.exlibrisgroup.com%2Fpermalink%2F01WPI_INST%2F12krsei%2Falma9936848091304746&docid=alma9936848091304746&lang=en,https://digitalcommons.wpi.edu/cgi/viewcontent.cgi?article=6179&context=iqp-all,"Jiusto, J. S. | Peet, R. Creighton",AN,helps students at the boys and girls club; not just females,https://docs.google.com/document/d/1lVKOqji9ns0dfwzOQy9mGVaRIpcqt7dMxR6AingPmX4/edit?usp=sharing,"To help the Boys & Girls Club of Worcester implement a sustainable after-school STEAM (Science, Technology, Engineering, Art, and Mathematics) program",Boys & Girls Club of Worcester,Designed and piloted high yield learning activities using the Club’s new Lego Mindstorms kits and 3D printer,STEAM and the Boys & Girls Club,,Education,Stem
42,Extending The Impact Of Technovation On Armenian School Girls,Apr-19,"Yerevan, Armenia","Yerevan, Armenia",Engineering--study And Teaching | Women Engineers--education | Mobile Apps,https://wpi.primo.exlibrisgroup.com/discovery/fulldisplay?context=L&vid=01WPI_INST:Default&search_scope=studentWorks&tab=https:%2F%2Fwpi.primo.exlibrisgroup.com%2Fpermalink%2F01WPI_INST%2F12krsei%2Falma9936880956904746&docid=alma9936880956904746&lang=en,https://digitalcommons.wpi.edu/cgi/viewcontent.cgi?article=6444&context=iqp-all,"Ault, Holly K. | Aghajanian, Michael J.",CS,"Visually pleasing report, lots of graphics",https://docs.google.com/document/d/1SNJuuMzhxG8w42pZFaykVDy_4CgOxocdjIi5QO7nKaU/edit?usp=sharing,"To identify opportunities to motivate and support the girls to continue developing their personal, professional, and technical skills","Schoolgirls in Armenia, stakeholders of Technovation Armenia, Women and Information Society NGO",Recommended a new organizational structure and a maturity model for Technovation Armenia,Supporting the girls of Technovation Armenia,,Education,Stem
43,Social Networking In First Robotics,Dec-10,On-campus,"Worcester, MA",Engineering--study And Teaching | Women--social Conditions,https://wpi.primo.exlibrisgroup.com/discovery/fulldisplay?context=L&vid=01WPI_INST:Default&search_scope=studentWorks&tab=https:%2F%2Fwpi.primo.exlibrisgroup.com%2Fpermalink%2F01WPI_INST%2F12krsei%2Falma9936832596004746&docid=alma9936832596004746&lang=en,https://digitalcommons.wpi.edu/cgi/viewcontent.cgi?article=1421&context=iqp-all,"Skorinko, Jeanine L.",CS,,https://docs.google.com/document/d/1CKlgomt9i79sVQJuztg9rJys_ya6eyt5Y3VyPr8QIQY/edit?usp=sharing,To look at the effects of social networking within FIRST Robotics,"Girls and boys involved in FIRST robotics, FIRST mentors","Females reported learning less in FIRST than males regardless of their prime; females had significantly lower self-efficacy than males regardless of their prime at the beginning of the season
",Analyzing social networks in FIRST robotics,Follow up to see if problems have changed or are still the same,Education,Stem
44,"Developing Digital Literacy Modules For Women In Cuenca, Ecuador",12/13/2018,"Cuenca, Ecuador","Cuenca, Ecuador",Women--violence Against,https://wpi.primo.exlibrisgroup.com/discovery/fulldisplay?context=L&vid=01WPI_INST:Default&search_scope=studentWorks&tab=https:%2F%2Fwpi.primo.exlibrisgroup.com%2Fpermalink%2F01WPI_INST%2F12krsei%2Falma9936861988304746&docid=alma9936861988304746&lang=en,http://www.wpi.edu/Pubs/E-project/Available/E-project-121318-141855/unrestricted/Full_IQP_Report_Digital_Literacy.pdf,"Selkow, Stanley M.",CS,Modules are presented in the appendices,https://docs.google.com/document/d/1TxFe4m522vJ1h0zrOdReUfPALJtd8eKaRPA08HI1mrk/edit?usp=sharing,"To create a set of educational models that could be used to teach digital literacy workshops at Mujeres con Éxito in Cuenca, Ecuador",Women at Mujeres con Éxito,Helped women that were victims of domestic abuse advance through teaching of computer literacy. Safety was heavily addressed when teaching internet and social media use,Digital literacy and victims of domestic abuse,,Education,Stem
45,Using Technology To Enhance Opportunities In A Disadvantaged Community Through Online Advocacy And Computer Education,05-04-15,"Melbourne, Australia","Broadmeadows, Victoria, Australia",Women--violence Against | Community Development | Science--study And Teaching,https://wpi.primo.exlibrisgroup.com/discovery/fulldisplay?context=L&vid=01WPI_INST:Default&search_scope=studentWorks&tab=https:%2F%2Fwpi.primo.exlibrisgroup.com%2Fpermalink%2F01WPI_INST%2F12krsei%2Falma9936832980404746&docid=alma9936832980404746&lang=en,http://www.wpi.edu/Pubs/E-project/Available/E-project-050415-073524/unrestricted/Banksia_Report_Final.pdf,"Ludwig, Reinhold| Skorinko, Jeanine L.",AN,Uses technology to try to solve social issues,https://docs.google.com/document/d/1g7f9mIJXvV9MXc20YzzBwJ5AKcZFfoVskdCtrKQp-LE/edit?usp=sharing,To develop a series of interactive advocacy videos to raise awareness of violence against women and the implement a computer science curriculum for the  Community Centre,"Women and children in the area, Banskia Gardens Community Services",Demonstrated an underlying theme that technology can provide a valuable asset for Banksia Gardens Community Services. It is hoped that the efforts become an enabler to reduce family violence and help reduce unemployment in communities not only in Broadmeadows but other challenged communities worldwide,Using interactive media to prevent violence against women,,Education,Stem
46,Women's Empowerment Through Increasing Access And Understanding Of Technology,12/17/2015,"Cape Town, South Africa","Cape Town, South Africa",Women--effect Of Technological Innovations On | Community Development | Teaching,https://wpi.primo.exlibrisgroup.com/discovery/fulldisplay?context=L&vid=01WPI_INST:Default&search_scope=studentWorks&tab=https:%2F%2Fwpi.primo.exlibrisgroup.com%2Fpermalink%2F01WPI_INST%2F12krsei%2Falma9936832997404746&docid=alma9936832997404746&lang=en,http://www.wpi.edu/Pubs/E-project/Available/E-project-121715-081812/unrestricted/WPI_CTPC-Sizakuyenza_IT_Programme_Executive_Summary.pdf,"Bulled, Nicola| Jiusto, J. S.",AN,Visually pleasing report,https://docs.google.com/document/d/1v9OyLE2zkMuMfVfy0J7erscsj3BzCVBvShLnlrX6_Vw/edit?usp=sharing,"To empower members of Sizakuyenza’s Women’s Networking Group (WNG) by addressing this digital divide in the township of Philippi, Cape Town","Sizakuyenza, women in Cape Town","Facilitated a pilot technology training programme, created an asset map of technology access points in local communities, developed a proposal to obtain funding for programme continuation and to establish a new technology access point at Sizakuyenza",Addressing the digital divide in Cape Town,,Education,Stem
0,A Follow Up Study On The Class Of 1990?,01-01-06,On-campus,WPI,Women In Engineering | Personality And Intelligence,https://wpi.primo.exlibrisgroup.com/discovery/fulldisplay?context=L&vid=01WPI_INST:Default&search_scope=studentWorks&tab=https:%2F%2Fwpi.primo.exlibrisgroup.com%2Fpermalink%2F01WPI_INST%2F12krsei%2Falma9936832790204746&docid=alma9936832790204746&lang=en,https://web.wpi.edu/Pubs/E-project/Scanned/06D284I.pdf,"Wilkes, John  M.",CS,"""Cognitive gender study""",https://docs.google.com/document/d/1XnKmfFaRIahoPgMG0PjSDNut1dVaHgXHTR7cMJaTQK4/edit?usp=sharing,Test the theory of gender and cognitive type as described in GCSI literature (people of a certain cognitive type have more/less success than in work force of different fields),WPI alumni,"Due to problems with data management, no results were presented. Information was available from the class of 2002, and it was suggested that their information be kept up to date so they could be studied in the future",Gender and cognitive components of success,,Education,Education at WPI
1,First Year Experience For Class Of 2003.,Jan-01,On-campus,WPI,Personality And Intelligence,https://wpi.primo.exlibrisgroup.com/discovery/fulldisplay?context=L&vid=01WPI_INST:Default&search_scope=studentWorks&tab=https:%2F%2Fwpi.primo.exlibrisgroup.com%2Fpermalink%2F01WPI_INST%2F12krsei%2Falma9936832833104746&docid=alma9936832833104746&lang=en,https://digitalcommons.wpi.edu/cgi/viewcontent.cgi?article=4557&context=iqp-all,"Wilkes, John M.",CS,Gender was just one component of the analysis,https://docs.google.com/document/d/1ULaTEQHhyxsAFxwCiTzwhewPiy4Y7uZQRYzQU1c6ALM/edit?usp=sharing,To assess the class of 2003 based on their GCSI and MBTI data and score them in groups to compare cognitive types,"WPI class of 2003, WPI",Answered questions about science and engineering; had two meetings a week- one was general and the other focused on a specific grade level. Was not committed to involving girls,Gender components of first year experience at WPI,,Education,Education at WPI
2,Change In Academic Motivation At Wpi,10/24/2011,On-campus,"Worcester, MA","Women In Engineering | Education, Higher",https://wpi.primo.exlibrisgroup.com/discovery/fulldisplay?context=L&vid=01WPI_INST:Default&search_scope=studentWorks&tab=https:%2F%2Fwpi.primo.exlibrisgroup.com%2Fpermalink%2F01WPI_INST%2F12krsei%2Falma9936832840304746&docid=alma9936832840304746&lang=en,http://www.wpi.edu/Pubs/E-project/Available/E-project-102411-105403/unrestricted/Change_in_Academic_Motivation_at_WPI.pdf,"Heinricher, Arthur C.",CS,,https://docs.google.com/document/d/1Hb0nE6hjI-wyUX3QYxk_7pzoLYtX83jyKOFwW-0dL38/edit?usp=sharing,To explore motivation in education and examine its change in first year students at WPI,WPI students and WPI as a whole,"There was a weak relationship between gender and academic motivation, but there was a relationship between how students viewed faculty and their academic motivation",Gender related changes in academic motivation,,Education,Education at WPI
3,Affects Of The Wpi Society On Students Over Time.,01-01-01,On-campus,"Worcester, Massachusetts",Women In Engineering |women Engineers--education | Women--social Conditions,https://wpi.primo.exlibrisgroup.com/discovery/fulldisplay?context=L&vid=01WPI_INST:Default&search_scope=studentWorks&tab=https:%2F%2Fwpi.primo.exlibrisgroup.com%2Fpermalink%2F01WPI_INST%2F12krsei%2Falma9936832806104746&docid=alma9936832806104746&lang=en,http://ezproxy.wpi.edu/login?url=http://www.wpi.edu/Pubs/E-project/Scanned/01E018I.pdf,"Dunn, Patrick P.",CS,More of a research study- no recommendations presented,https://docs.google.com/document/d/1BaPD3CfcK5ocqwrVvC1zf3SxB14RRPXBX7VsAy6nbxU/edit?usp=sharing,"To give information about the flaws in the WPI society that can be fixed; identify major changes students go through and, by comparing to changes at Assumption College, identify problem areas",Students at WPI and Assumption college,Developed and tested a series of workshops for WPI Camp REACH alumni- helps retain interest in STEM,Negative perceptions? Social pressures of female WPI students,Possible IQP- redo survey,Education,Education at WPI
4,Social Programming At Worcester Polytechnic Institute,01-01-06,On-campus,"Worcester, MA","Women--violence Against| Education, Higher | Community Development | Mental Health",https://wpi.primo.exlibrisgroup.com/discovery/fulldisplay?context=L&vid=01WPI_INST:Default&search_scope=studentWorks&tab=https:%2F%2Fwpi.primo.exlibrisgroup.com%2Fpermalink%2F01WPI_INST%2F12krsei%2Falma9936832765004746&docid=alma9936832765004746&lang=en,http://ezproxy.wpi.edu/login?url=http://www.wpi.edu/Pubs/E-project/Scanned/06D267I.pdf,"Hakim, Hossein",AN,Gender was just one component of the analysis,https://docs.google.com/document/d/1TvbqfjV2A2w7UYC7px-D06THea6PZ67ZbS0TsC0DKAI/edit?usp=sharing,To improve the understanding of student life at WPI and identify the needs of the students,"WPI, WPI students, Student Government Association (SGA)",Found that a large percentage of students aren't socially confident in themselves,Programming to improve mental and social well-being of WPI students,,Education,Education at WPI
5,Acute And Chronic Stressor Mechanisms In Health Disparities,3/24/2017,On-campus,"Worcester, Massachusetts",Women In Engineering | Women In Science | Women--social Conditions | Equality--social Aspects | Mental Health,https://wpi.primo.exlibrisgroup.com/discovery/fulldisplay?context=L&vid=01WPI_INST:Default&search_scope=studentWorks&tab=https:%2F%2Fwpi.primo.exlibrisgroup.com%2Fpermalink%2F01WPI_INST%2F12krsei%2Falma9936832607704746&docid=alma9936832607704746&lang=en,http://www.wpi.edu/Pubs/E-project/Available/E-project-032417-141744/unrestricted/MICRO_IQP_SUBMIT.pdf,"O'Brien, Kymberlee M.",CS,"Focused mainly on racial microaggressions, but related them to gender",https://docs.google.com/document/d/12ArvPjfY1KpCbF6PvXvwHOuMk4ZPpid76jw30qEky1w/edit?usp=sharing,To evaluate the impact and frequency of microaggressions,"Minority groups (women, racial minorities)","Revealed the state of microaggressions at WPI- females self-reported the most microaggressions and daily discrimination. Seniors experienced the most microaggressions, and people of a perceived higher social standing did not have a strong response to microaggressions. ",gender and racial microaggressions at WPI?,,Education,Education at WPI
6,An Investigation Of Linguistic Complexity By Sex And Minority Status Under Stress,7/31/2018,On-campus,"Worcester, MA",Minorities | Women--social Conditions,https://wpi.primo.exlibrisgroup.com/discovery/fulldisplay?context=L&vid=01WPI_INST:Default&search_scope=studentWorks&tab=https:%2F%2Fwpi.primo.exlibrisgroup.com%2Fpermalink%2F01WPI_INST%2F12krsei%2Falma9936849607204746&docid=alma9936849607204746&lang=en,http://www.wpi.edu/Pubs/E-project/Available/E-project-073118-115008/unrestricted/An_Investigation_of_Linguistic_Complexity__by_Sex_and_Minority_Status_Under_Stress.pdf,"Skorinko, Jeanine L. | O'Brien, Kymberlee",CS,,https://docs.google.com/document/d/1il0lmwBTUmuHnSAqo6VmYGN9LhOW9WZ7AXbORO47XhI/edit?usp=sharing,"To determine if the speech between men, women, and minorities is different under stress; to determine if these differences are found between speaking and self-reported experiences",WPI students,"Content words- females higher in categories of friend, female, sexual, archive, and reward; males higher in clout and words per second","How stress affects speech between women, men, and minorities",,Education,Education at WPI
7,An Analysis Of The Effectiveness Of Bridging Of Fundamental Courses In The First Year,Jan-00,On-campus,WPI,Science--study And Teaching | Project Method In Teaching,https://wpi.primo.exlibrisgroup.com/discovery/fulldisplay?context=L&vid=01WPI_INST:Default&search_scope=studentWorks&tab=https:%2F%2Fwpi.primo.exlibrisgroup.com%2Fpermalink%2F01WPI_INST%2F12krsei%2Falma9936832801904746&docid=alma9936832801904746&lang=en,https://digitalcommons.wpi.edu/cgi/viewcontent.cgi?article=4873&context=iqp-all,"Miller, Judith E. | Goulet, John A.",CS,"More focused on students overall, but did mention some results by gender",https://docs.google.com/document/d/1u9Jlu7ygi6Yj4RSxD1DI1kg08odafYU6RP8NZW7aM9E/edit?usp=sharing,"To assess the effectiveness of the ""bridging model"" based on students' performance in courses and change in students' attitudes towards engineering and science","WPI students, WPI professors","The survey results demonstrated increases in bridged students' self-confidence in their problem solving abilities, and basic engineering knowledge and skills",Gender components of the bridging model,,Education,Education at WPI
8,Six Degrees Of Wpi,Jan-02,On-campus,WPI,"Education, Higher",https://wpi.primo.exlibrisgroup.com/discovery/fulldisplay?context=L&vid=01WPI_INST:Default&search_scope=studentWorks&tab=https:%2F%2Fwpi.primo.exlibrisgroup.com%2Fpermalink%2F01WPI_INST%2F12krsei%2Falma9936832776204746&docid=alma9936832776204746&lang=en,https://digitalcommons.wpi.edu/cgi/viewcontent.cgi?article=5597&context=iqp-all,"Fisler, Kathryn | Selkow, Stanley | Schull, Jon",CS,"Project tried to examination correlation between gender and amount of emails sent, but there was no relation",https://docs.google.com/document/d/1ZXtHONqDd3eQBHqV63FKO4BvVQznK3ZYf6zgzw2Yy74/edit?usp=sharing,To examine the properties of social networks in the WPI community and attempts to provide answers or more information on issues that are important to providing for such a network at the WPI community,Students and faculty/staff at WPI,No correlation was found between the amount of emails and gender ratios,Social networks at WPI,,Education,Education at WPI
9,The Effect Of Instructor Gender And Student Gender On Course Evaluations,01-01-99,On-campus,"Worcester, MA",Women In Science,https://wpi.primo.exlibrisgroup.com/discovery/fulldisplay?context=L&vid=01WPI_INST:Default&search_scope=studentWorks&tab=https:%2F%2Fwpi.primo.exlibrisgroup.com%2Fpermalink%2F01WPI_INST%2F12krsei%2Falma9936832823204746&docid=alma9936832823204746&lang=en,http://ezproxy.wpi.edu/login?url=http://www.wpi.edu/Pubs/E-project/Scanned/99B002I.pdf,"Miller, Judith E.| Ruiz, Carolina",AN,Very outdated recommendations- show the double standard of women in the workplace,https://docs.google.com/document/d/1S_zILe43A0vGLiDH51udFQcKUadpQMl0OFvNau9w_vk/edit?usp=sharing,To determine the effects of instructor gender and student gender on student evaluations of the professors at Worcester Polytechnic Institute,WPI professors,The results seemed to show that female professors received lower ratings than male professors and female professors receive their highest ratings from female students and their lowest ratings from male students- but sample size was too small to draw a definite conclusion,The effect of instructor and student gender on course evaluations,Redo study (PLEASE),Education,Education at WPI
10,Coeducational Living In On-campus Suites And Apartments.,01-01-04,On-campus,WPI,Women|mental Health | Community Development,https://wpi.primo.exlibrisgroup.com/discovery/fulldisplay?context=L&vid=01WPI_INST:Default&search_scope=studentWorks&tab=https:%2F%2Fwpi.primo.exlibrisgroup.com%2Fpermalink%2F01WPI_INST%2F12krsei%2Falma9936832893404746&docid=alma9936832893404746&lang=en,http://ezproxy.wpi.edu/login?url=http://www.wpi.edu/Pubs/E-project/Scanned/04C024I.pdf,"Addison, W. A. | Clay, Philip",CS,,https://docs.google.com/document/d/1uS-AbzzH5HRtiDxFp_gaGCkzL0e_ufhSWbaGRb6dpD0/edit?usp=sharing,To argue that coeducational housing on-campus should be an option for interested students,WPI students,Women seemed to favor co-ed housing as lower stress than living with all females,Coed living at WPI,,Education,Education at WPI
11,Alternate Reality Game For Wpi Admissions.,01-01-07,On-campus,"Worcester, MA",Virtual Reality |marketing | Women In Engineering,https://wpi.primo.exlibrisgroup.com/discovery/fulldisplay?context=L&vid=01WPI_INST:Default&search_scope=studentWorks&tab=https:%2F%2Fwpi.primo.exlibrisgroup.com%2Fpermalink%2F01WPI_INST%2F12krsei%2Falma9936832962504746&docid=alma9936832962504746&lang=en,https://web.wpi.edu/Pubs/E-project/Scanned/07E037I/07E037I.pdf,"O'Donnell, Dean M.",CS,"Abstract mentions boosting number of women enrolling at WPI, but no specific data is mentioned in the paper",https://docs.google.com/document/d/1qJ34VeIq6MU4WTtPNS7jLNOb5oOf8a8IwCMukw6NSB4/edit?usp=sharing,Create a successful and fun alternate reality game; help WPI Admissions increase number of admitted students who decide to attend WPI; bring attention to IMGD program,"WPI Admissions, students admitted to WPI class of 2011","The game was not very successful as a marketing tool (only 500 visitors to the site)- more marketing should be done in order to obtain more visitors. The goal mentioned increasing the number of females at WPI, but did not present any specific data on this.",Attracting female students to WPI through AR games,,Education,Education at WPI
12,Attracting And Retaining Women In Ece.,01-01-00,On-campus,WPI,Women In Engineering | Women Engineers--education,https://wpi.primo.exlibrisgroup.com/discovery/fulldisplay?context=L&vid=01WPI_INST:Default&search_scope=studentWorks&tab=https:%2F%2Fwpi.primo.exlibrisgroup.com%2Fpermalink%2F01WPI_INST%2F12krsei%2Falma9936832868604746&docid=alma9936832868604746&lang=en,http://ezproxy.wpi.edu/login?url=http://www.wpi.edu/Pubs/E-project/Scanned/00E013I.pdf,"Nicoletti, Denise W.",CS,,https://docs.google.com/document/d/1op1HOBrsRw-YcKYhSj-spt0tRDxuwZzwo5ZOs7R9ezs/edit?usp=sharing,Examine underrepresentation of women in ECE and why it is a problem; determine if changing or creating the department’s marketing strategies will have a positive impact on women who choose ECE as a major,"ECE students, ECE department, WPI as an organization","In order to increase the number of females enrolled in ECE, tour guides should convey general information when outside Atwater Kent, information packages targeted at young women should be developed, undeclared majors should be assigned academic advisors in ECE, and the number of ECE faculty should be increased",Gender components of ECE education at WPI,Might be interesting to redo and see if the type of problem has changed,Education,Education at WPI
13,Computer Science Experience At Wpi,Apr-17,On-campus,WPI,"Science--study And Teaching | Women In Science | Education, Higher",https://wpi.primo.exlibrisgroup.com/discovery/fulldisplay?context=L&vid=01WPI_INST:Default&search_scope=studentWorks&tab=https:%2F%2Fwpi.primo.exlibrisgroup.com%2Fpermalink%2F01WPI_INST%2F12krsei%2Falma9936832582504746&docid=alma9936832582504746&lang=en,https://digitalcommons.wpi.edu/cgi/viewcontent.cgi?article=3914&context=iqp-all,"Wills, Craig E.",CS,"Not specifically focused on women, but does mention results by gender",https://docs.google.com/document/d/1rOZWftrvjGSijIdlDqEYIctqmvqUF6BYZIqHELmTrcw/edit?usp=sharing,"To determine how demographic, experience, and confidence affects computer science students at WPI","Students at WPI- mainly computer science students, but also related majors",Males had more confidence than females overall- especially prior to college,Gender components of CS education at WPI,,Education,Education at WPI
14,Attraction And Retention Of Women In Computer Science At Worcester Polytechnic Institute,03-02-17,On-campus,WPI,Women In Science | Women--education--science,https://wpi.primo.exlibrisgroup.com/discovery/fulldisplay?context=L&vid=01WPI_INST:Default&search_scope=studentWorks&tab=https:%2F%2Fwpi.primo.exlibrisgroup.com%2Fpermalink%2F01WPI_INST%2F12krsei%2Falma9936832587004746&docid=alma9936832587004746&lang=en,http://www.wpi.edu/Pubs/E-project/Available/E-project-030217-110352/unrestricted/IQP_Report.pdf,"Fisler, Kathryn",CS,,https://docs.google.com/document/d/1nhf_nxN_GZy2OtUL_XyjDTO_p4_gy-BW8A1rwPCTXYg/edit?usp=sharing,To help the Computer Science Department at Worcester Polytechnic Institute understand the underlying reasons why female students are underrepresented in the department,"CS students, CS faculty, CS department","Gave recommendations for CS students, faculty, and department in order to increase student-student and student-faculty interactions, increase number of work areas for students, and increase academic advisors' connects with students",Gender components of CS education at WPI,,Education,Education at WPI
