,Title,Date,Project Center,Location,Subject Terms,Link,Alternative Link,Advisors,Initials,Notes,Link to summary,Goal,Stakeholders,Impact,Headline,Follow-up,Category,Sub_Category
63,Health And Technology In Rowing: A Healthier Process Of Making Weight For The Lightweight Rower,01-01-00,On-campus,"Worcester, MA",Mental Health|women--health,https://wpi.primo.exlibrisgroup.com/discovery/fulldisplay?context=L&vid=01WPI_INST:Default&search_scope=studentWorks&tab=https:%2F%2Fwpi.primo.exlibrisgroup.com%2Fpermalink%2F01WPI_INST%2F12krsei%2Falma9936832912404746&docid=alma9936832912404746&lang=en,http://ezproxy.wpi.edu/login?url=http://www.wpi.edu/Pubs/E-project/Scanned/00A011I.pdf,"Brown, Christopher A.",CS,,https://docs.google.com/document/d/16S0aqgdZ8myCVqOBfbRHRI7bEu9IVP-yxnsjLI3hhBU/edit?usp=sharing,To understand the issues surrounding weight loss in rowing and suggest recommendations for making weight healthier for lightweight athletes,"Women on college rowing teams, coaches of rowing teams",Found that women on college rowing teams were more concerned with making weight than the health effects of it; many athletes did not know about long term health risks of making weight,Health risks of making weight in rowing,,Health,Athletics
64,Health And Technology In Rowing -- An Assessment Of Coaches' Knowledge Of The Healthy Limits Of Women.,01-01-02,On-campus,"Worcester, MA",Mental Health|women--health,https://wpi.primo.exlibrisgroup.com/discovery/fulldisplay?context=L&vid=01WPI_INST:Default&search_scope=studentWorks&tab=https:%2F%2Fwpi.primo.exlibrisgroup.com%2Fpermalink%2F01WPI_INST%2F12krsei%2Falma9936832887004746&docid=alma9936832887004746&lang=en,http://ezproxy.wpi.edu/login?url=http://www.wpi.edu/Pubs/E-project/Scanned/02D108I.pdf,"Brown, Christopher A.",CS,,https://docs.google.com/document/d/1EubdI9CPJEV5qRV3bTaSmyi1l77lhLU7knqNS6231vk/edit?usp=sharing,To determine whether or not coaches have realistic opinions about the limits of a woman’s body in the context of becoming a lightweight rower,"Coaches of lightweight women, lightweight women rowers","Revealed that coaches often thought other lightweight rowers were too thin, but did not as often consider this about their own athletes",Coaches' perceptions of making weight in rowing,,Health,Athletics
65,Human Interactions And Decision-making In Recreational Avalanche Environments,Jan-02,On-campus,"Worcester, MA",Risk Management,https://wpi.primo.exlibrisgroup.com/discovery/fulldisplay?context=L&vid=01WPI_INST:Default&search_scope=studentWorks&tab=https:%2F%2Fwpi.primo.exlibrisgroup.com%2Fpermalink%2F01WPI_INST%2F12krsei%2Falma9936832913104746&docid=alma9936832913104746&lang=en,https://digitalcommons.wpi.edu/cgi/viewcontent.cgi?article=5200&context=iqp-all,"Theyel, Gregory | Davis, Paul W.",CS,"Speculations about why women might be involved in less avalanche-related deaths, but nothing concrete",https://docs.google.com/document/d/1FWaQMoQXBmTO_S5JgPVjaPOHdi8ic9UATtDgNr9NNvU/edit?usp=sharing,To help reduce the number of avalanche deaths by studying the decision-making processes of individuals recreating in alpine environments,Skiers,Women are less likely to die in avalanches while participating in alpine recreation,Gender related components of avalanche related deaths,,Health,Athletics
53,Enhancing The Mentor Network At Voces Vitales Costa Rica,05-06-15,"San Jose, Costa Rica","San Jose, Costa Rica",Women--social Conditions,https://wpi.primo.exlibrisgroup.com/discovery/fulldisplay?context=L&vid=01WPI_INST:Default&search_scope=studentWorks&tab=https:%2F%2Fwpi.primo.exlibrisgroup.com%2Fpermalink%2F01WPI_INST%2F12krsei%2Falma9936832975804746&docid=alma9936832975804746&lang=en,http://www.wpi.edu/Pubs/E-project/Available/E-project-050615-015232/unrestricted/Enhancing_the_Mentor_Network_at_Voces_Vitales_Costa_Rica.pdf,"Madan, Aarti S.| Madan, Ryan S.",CS,Vital Voices helps women who are victims of domestic abuse,https://docs.google.com/document/d/1o5gNCK622kOArgEc_pKm_XF95fqFJgNnLEmDodko3bg/edit?usp=sharing,To understand and evaluate the preexisting mentor network and analyze the best practices for networking for Vital Voices,"Voces Vitales (VVCR), mentors at VVCR",Recommendations were made to help develop the mentor network at VVCR,Mentor networks for domestic violence victims in Costa Rica,,Health,Domestic Violence
54,Helping Vital Voices Impact More Women: Developing An Online Mentoring Platform,03-01-18,"San Jose, Costa Rica","San Jose, Costa Rica",Women|websites--design And Construction,https://wpi.primo.exlibrisgroup.com/discovery/fulldisplay?context=L&vid=01WPI_INST:Default&search_scope=studentWorks&tab=https:%2F%2Fwpi.primo.exlibrisgroup.com%2Fpermalink%2F01WPI_INST%2F12krsei%2Falma9936832969004746&docid=alma9936832969004746&lang=en,http://www.wpi.edu/Pubs/E-project/Available/E-project-030118-111932/unrestricted/VVCR_IQP_FinalReport_SanJose2018.pdf,"Chiarelli, James A.| McCauley, Stephen M.",CS,Website screenshots: https://drive.google.com/drive/folders/1lXF0LUAUBUf3O5vIsooryPiaWNUr8BtH ,https://docs.google.com/document/d/18Y84z8dx4mA2WEKn6zPwNhD2LHWwzjBqVkWYBwJbpkU/edit?usp=sharing,To help Vital Voices Costa Rica (VVCR) impact more women,Voces Vitales and the women they work with,Created mockups for web platforms and an implementation guide for Voces Vitales so they could have a better mentor network,Online mentoring for domestic violence victims in Costa Rica,,Health,Domestic Violence
55,"Permaculture Design Plan For María Amor Foundation, Cuenca Ecuador",12-12-18,"Cuenca, Ecuador","Cuenca, Ecuador",City Planning|agriculture|sustainable Development,https://wpi.primo.exlibrisgroup.com/discovery/fulldisplay?context=L&vid=01WPI_INST:Default&search_scope=studentWorks&tab=https:%2F%2Fwpi.primo.exlibrisgroup.com%2Fpermalink%2F01WPI_INST%2F12krsei%2Falma9936861986504746&docid=alma9936861986504746&lang=en,http://www.wpi.edu/Pubs/E-project/Available/E-project-121218-181752/unrestricted/Report.pdf,"Selkow, Stanley M.",AN,The María Amor foundation is a women's shelter for domestic abuse victims. Additional media located at: https://web.wpi.edu/Pubs/E-project/Available/E-project-121218-181752/unrestricted/Master_Plan.pdf and https://web.wpi.edu/Pubs/E-project/Available/E-project-121218-181752/unrestricted/Deliverable.pdf,https://docs.google.com/document/d/1gabfstD-_FPBJrYg8cG71XhpdtJb9yf_XPiZD4fOsPA/edit?usp=sharing,To design an integrated land-use plan to provide food for internal use as well as to sell,Women and their children who are victims of domestic abuse,"Developed a landscape design that includes values of permaculture to create the most practical land use plan for the María Amor foundation; also takes into account existing landscape features and buildings to layout an achievable, sustainable and functional farm","Permaculture for DV victims in Cuenca, Ecuador",,Health,Domestic Violence
56,Preventing Violence Against Women: Training Resources To Empower The Broadmeadows Community,05-02-16,"Melbourne, Australia","Melbourne, Australia",Family Violence|equality--social Aspects,https://wpi.primo.exlibrisgroup.com/discovery/fulldisplay?context=L&vid=01WPI_INST:Default&search_scope=studentWorks&tab=https:%2F%2Fwpi.primo.exlibrisgroup.com%2Fpermalink%2F01WPI_INST%2F12krsei%2Falma9936833025404746&docid=alma9936833025404746&lang=en,http://www.wpi.edu/Pubs/E-project/Available/E-project-050216-071211/unrestricted/Banksia-D16-Final-Report.pdf,"Ault, Holly K.| Hanlan, James P.",AN,,https://docs.google.com/document/d/1Zj2hC4tuE0K2AKEMKwj_ysgpAbooIulBySgxk86PdTw/edit?usp=sharing,To create and develop training resources to educate and empower the community to prevent violence against women,"Banskia Gardens Community Services, members of the Broadmeadows community",Findings were used to develop Good People Act Now training resources and design the Good Children Act Now program to help stop violence against women,Training resources to prevent DV in Australia,,Health,Domestic Violence
57,Violence Against Women: Using Interactive Performance To Inspire Change,12-11-16,"Melbourne, Australia","Hume, Australia",Women--violence Against | Community Development | Websites--design And Construction,https://wpi.primo.exlibrisgroup.com/discovery/fulldisplay?context=L&vid=01WPI_INST:Default&search_scope=studentWorks&tab=https:%2F%2Fwpi.primo.exlibrisgroup.com%2Fpermalink%2F01WPI_INST%2F12krsei%2Falma9936833147904746&docid=alma9936833147904746&lang=en,http://www.wpi.edu/Pubs/E-project/Available/E-project-121116-054155/unrestricted/Banksia_Booklet_FINAL.pdf,"Higgins, Lorraine D.| Ottmar, Erin R.",AN,Visually pleasing report,https://docs.google.com/document/d/1yx7mKxTergx7rkmog44a03ULT1zctijsUYUaJW6fSvc/edit?usp=sharing,"To assist GPAN (Good People Act Now) in its violence prevention work, particularly cyber abuse against women","GPAN, women in the area",Raised awareness about abuse of women by targeting youth; also produced infographics and pamphlets and updated the GPAN website,Preventing cyber abuse against women in Australia,,Health,Domestic Violence
58,Fund Raising Methods,4/22/2009,On-campus,"Worcester, MA",Fund Raising|women,https://wpi.primo.exlibrisgroup.com/discovery/fulldisplay?context=L&vid=01WPI_INST:Default&search_scope=studentWorks&tab=https:%2F%2Fwpi.primo.exlibrisgroup.com%2Fpermalink%2F01WPI_INST%2F12krsei%2Falma9936832580004746&docid=alma9936832580004746&lang=en,http://www.wpi.edu/Pubs/E-project/Available/E-project-042209-122413/unrestricted/Fund_Raising_Methods.pdf,"Hakim, Hossein",CS,,https://docs.google.com/document/d/1ENWsABbRoq0Ham4LgjYJH2h-7ni5R0dRjas1P8WjSlg/edit?usp=sharing,"Study women’s issues such as drug abuse, homelessness, domestic abuse, and poverty; recommend new approach and help fundraise for women at Abby’s House","Abby’s House, women at Abby’s House",Evaluated different methods of fundraising and found that asking for help from large companies was the most effective,Fundraising methods for Abby's House,,Health,Homelessness
59,Fundraising For Homeless Women And Children,3/13/2012,On-campus,"Worcester, MA",Fund Raising|women--social Conditions,https://wpi.primo.exlibrisgroup.com/discovery/fulldisplay?context=L&vid=01WPI_INST:Default&search_scope=studentWorks&tab=https:%2F%2Fwpi.primo.exlibrisgroup.com%2Fpermalink%2F01WPI_INST%2F12krsei%2Falma9936832858804746&docid=alma9936832858804746&lang=en,http://www.wpi.edu/Pubs/E-project/Available/E-project-031312-161000/unrestricted/IQP_REPORT.pdf,"Hakim, Hossein",CS,,https://docs.google.com/document/d/1POTUik6TiZN-kLzXzHWzfRS_KUIraTIFCXcHzQeINNI/edit?usp=sharing,"To understand homelessness, to collect monetary aid and essential goods for Abby's House, to raise awareness in the WPI community about homelessness","Abby’s House, women at Abby’s House, people in the WPI community","Found that fundraising could be improved by more advertising, longer fundraising periods, and expanding the audience",Fundraising methods for Abby's House,,Health,Homelessness
66,Internet Abuse In The Workplace.,01-01-03,On-campus,"Worcester, MA",Women Employees | Women--social Conditions,https://wpi.primo.exlibrisgroup.com/discovery/fulldisplay?context=L&vid=01WPI_INST:Default&search_scope=studentWorks&tab=https:%2F%2Fwpi.primo.exlibrisgroup.com%2Fpermalink%2F01WPI_INST%2F12krsei%2Falma9936832909604746&docid=alma9936832909604746&lang=en,http://ezproxy.wpi.edu/login?url=http://www.wpi.edu/Pubs/E-project/Scanned/03E016I.pdf,"Elmes, Michael B.",AN,,https://docs.google.com/document/d/1fgT3StUgH2ys2dGgvUIMobthi7L4xKD9nz3BR12g8Jo/edit?usp=sharing,The purpose and focus of this study is to research more effective means of managing the internet in the workplace to prevent employee abuse while being aware of the ethical and professional responsibilities of the employer,Employees and employers,"Found that there is an obvious need for enhanced management techniques that not only detect and report Internet abuse but aid in preventing it as well
",Preventing internet abuse in the workplace,,Health,No Sub-Category
67,Mitigating Noxious Gases Produced By Traditional Cooking Methods,05-01-16,"Mandi, India","Mandi, India",Air--pollution|public Health|community Development,https://wpi.primo.exlibrisgroup.com/discovery/fulldisplay?context=L&vid=01WPI_INST:Default&search_scope=studentWorks&tab=https:%2F%2Fwpi.primo.exlibrisgroup.com%2Fpermalink%2F01WPI_INST%2F12krsei%2Falma9936833130804746&docid=alma9936833130804746&lang=en,http://www.wpi.edu/Pubs/E-project/Available/E-project-050116-231501/unrestricted/Mitigating_Noxious_Gases.pdf,"McCauley, Stephen M.| Shockey, Ingrid K.",AN,This project specifically affects women because of the cooking they do using the stoves; report is visually pleasing,https://docs.google.com/document/d/187K-7IQxCo18qJwzOZg4QFQDDmoHSgEeCMz_yojC78Q/edit?usp=sharing,To mitigate the gas production caused by this fuel and to alleviate the negative health effects,Rural village residents in Himachal Pradesh,Traditional stoves cause exposure to noxious gases- new prototype developed should prevent this. Women were impacted because they do most of the cooking,Prototyping stoves to prevent noxious gases,,Health,No Sub-Category
68,The Zimri Project: Running Water And Bathroom Facilities For A Rural Moroccan School,10/28/2008,"Rabat, Morocco","Zimri, Morocco",Women--social Conditions | Community Development | Women--effect Of Technological Innovations On,https://wpi.primo.exlibrisgroup.com/discovery/fulldisplay?context=L&vid=01WPI_INST:Default&search_scope=studentWorks&tab=https:%2F%2Fwpi.primo.exlibrisgroup.com%2Fpermalink%2F01WPI_INST%2F12krsei%2Falma9936832866804746&docid=alma9936832866804746&lang=en,http://www.wpi.edu/Pubs/E-project/Available/E-project-102808-180401/unrestricted/ZimriProjectReport.pdf,"Addison, W. A.| El-Korchi, Tahar",AN,"No direct connection could be drawn between having private bathroom facilities and increasing the number of girls enrolled at schools, but that was the hope for developing the recommendations for the private bathroom",https://docs.google.com/document/d/1YgjIk8kH9X_SiHb3yhiBbitxPv9DxGUi93x1Sxc193E/edit?usp=sharing,"To develop a plan for bringing running water to a school in Zimri, Morocco and for building an enclosed bathroom facility",Schoolchildren in Zimri,The findings from the research pointed to the conclusion that a solar powered pumping system along with a compost toilet would work best for the conditions of the Zimri village. The hope is that having an enclosed bathroom facility would allow girls to come to school again,Water in schools to encourage girls' education in Morocco,"See if long term plans were put into place- if not, see how it could be facilitated",Health,No Sub-Category
69,Recommendations To Improve Quality Of Life At The Pakkred Home,01-01-03,"Bangkok, Thailand","Bangkok, Thailand",Women--health | Mental Health,https://wpi.primo.exlibrisgroup.com/discovery/fulldisplay?context=L&vid=01WPI_INST:Default&search_scope=studentWorks&tab=https:%2F%2Fwpi.primo.exlibrisgroup.com%2Fpermalink%2F01WPI_INST%2F12krsei%2Falma9936832937004746&docid=alma9936832937004746&lang=en,https://digitalcommons.wpi.edu/cgi/viewcontent.cgi?article=4958&context=iqp-all,"Demetry, Chrysanthe | Vaz, Richard F.",CS,Lots of visuals in the report,https://docs.google.com/document/d/1kNq2jvuVAh3KMiJITqgYG9Liy7lCK6kLNU-hi5vnSRc/edit?usp=sharing,"To identify needs for improvement, generate a prioritized list of these needs, and develop recommendations for improvement at Pakkred Home","International Support Group, Pakkred Home, girls in Pakkred Home","Developed a lengthy list of recommendations to improve quality of life, including repairing toilets and the water distribution system",Improving quality of life at a girls home,Evaluate current state of facility,Health,No Sub-Category
70,Talking About Food: Improving Communication Between Ghanaian Women And Medical Practitioners,03-09-14,On-campus,"Worcester, MA",Women--health | Medical Care,https://wpi.primo.exlibrisgroup.com/discovery/fulldisplay?context=L&vid=01WPI_INST:Default&search_scope=studentWorks&tab=https:%2F%2Fwpi.primo.exlibrisgroup.com%2Fpermalink%2F01WPI_INST%2F12krsei%2Falma9936832949604746&docid=alma9936832949604746&lang=en,http://www.wpi.edu/Pubs/E-project/Available/E-project-030914-205013/unrestricted/IQP_Final_Report.pdf,"Elmes, Michael B.| Hersh, Robert",AN,,https://docs.google.com/document/d/1grCp_zNZjGl6ZuC418MluCJLa5e5ZD6KKpvDI3hKe4k/edit?usp=sharing,"To address communication barriers between medical practitioners and Ghanaian women on issues related to nutrition, food preparation, and the role of food in Ghanaian culture, by producing educational videos targeted at medical practitioners",Ghanian patients and medical practitioners,"Produced videos to help improve communication between medical practitioners and the Ghanaian community about nutrition, food choices, and the cultural aspect of eating",Bettering nutrition for Ghanian women,,Health,No Sub-Category
60,Social And Technological Aspects Of Ru486.,01-01-99,On-campus,"Worcester, MA",Women--health,https://wpi.primo.exlibrisgroup.com/discovery/fulldisplay?context=L&vid=01WPI_INST:Default&search_scope=studentWorks&tab=https:%2F%2Fwpi.primo.exlibrisgroup.com%2Fpermalink%2F01WPI_INST%2F12krsei%2Falma9936832832404746&docid=alma9936832832404746&lang=en,http://ezproxy.wpi.edu/login?url=http://www.wpi.edu/Pubs/E-project/Scanned/99D324I.pdf,"Jamison, Wesley V.",AN,,https://docs.google.com/document/d/1rg-jBT7-QocWK2tYl-dkdhMrkjMOpEzzHYIjzQhU52I/edit?usp=sharing,To develop an educational web page with info about RU486 and other abortion techniques (including procedural) and the pros and cons of each technique,Women,"Listed three main issues to the abortion debate: status of the embryo, how to access facts surrounding the issue, and the debate about abortion is actually a debate about the role of a person
",Social and technological aspects of abortion,,Health,Reproductive
61,Exploring Intravaginal Ring Acceptability For Disease Prevention Among At-risk Community Members In Cape Town,12/14/2017,"Cape Town, South Africa","Cape Town, South Africa",Public Health|women--health,https://wpi.primo.exlibrisgroup.com/discovery/fulldisplay?context=L&vid=01WPI_INST:Default&search_scope=studentWorks&tab=https:%2F%2Fwpi.primo.exlibrisgroup.com%2Fpermalink%2F01WPI_INST%2F12krsei%2Falma9936833039004746&docid=alma9936833039004746&lang=en,http://www.wpi.edu/Pubs/E-project/Available/E-project-121417-014811/unrestricted/IQP_FINAL_REPORT.pdf,"Bulled, Nicola| Skorinko, Jeanine L.",CS,"The report itself is visually pleasing, and there is a good infographic in the appendix",https://docs.google.com/document/d/1cPdRkhz9gzmbtJZKU4H1Q0QbKrk1qvLWhcLTVAHPTas/edit?usp=sharing,To explore IVR acceptability and accessibility preferences within at-risk populations outside of the context of a clinical trial in order to assess promoters and barriers to product adherence that may ultimately affect product efficacy,"Sizakuyenza, at-risk men and women in Cape Town","Found that women had limited use of intravaginal products (such as tampons), which might present difficulties when inserting the IVR; both men and women would appreciate the additional protection; and misuse and stigmatization surrounds IVRs
",Exploring IVR acceptability in Cape Town,Follow up to determine if stigmas have changed,Health,Reproductive
62,Supporting Breastfeeding Mothers At Work And At Home In Indonesia,4/19/2018,On-campus,"Worcester, MA",Women--health | Community Development,https://wpi.primo.exlibrisgroup.com/discovery/fulldisplay?context=L&vid=01WPI_INST:Default&search_scope=studentWorks&tab=https:%2F%2Fwpi.primo.exlibrisgroup.com%2Fpermalink%2F01WPI_INST%2F12krsei%2Falma9936895942204746&docid=alma9936895942204746&lang=en,http://www.wpi.edu/Pubs/E-project/Available/E-project-041918-103255/unrestricted/Supporting_Breastfeeding_Mothers_at_Work_and_at_Home_in_Indonesia.pdf,"Stoddard, Elisabeth A.",AN,,https://docs.google.com/document/d/1sxAayHaZZHLXWMVTcnFUoBv8iZXSPqGekvaOXwv8SSg/edit?usp=sharing,To understand the challenges that women working in factories in Indonesia face in providing breastmilk to their infants,"Babies in Common, breastfeeding mothers in Indonesia","Found that that there was a need for greater educational and policy support at the home, work, and community level for breastfeeding",Supporting breastfeeding mothers in Indonesia,,Health,Reproductive
48,A Study Of Patient Treatment Scheduling At The Gillette Center For Women's Cancers.,01-01-03,"Boston, Massachusetts","Boston, Massachusetts",Automation |women--health,https://wpi.primo.exlibrisgroup.com/discovery/fulldisplay?context=L&vid=01WPI_INST:Default&search_scope=studentWorks&tab=https:%2F%2Fwpi.primo.exlibrisgroup.com%2Fpermalink%2F01WPI_INST%2F12krsei%2Falma9936832912604746&docid=alma9936832912604746&lang=en,http://ezproxy.wpi.edu/login?url=http://www.wpi.edu/Pubs/E-project/Scanned/03D178I.pdf,"Demetry, Chrysanthe| Volkoff, Olga",CS,,https://docs.google.com/document/d/1FYTy9JFIbIncUcKrkmYQQGn20CYL_cQmEobmCNpDpKM/edit?usp=sharing,Sought to determine requirements for treatment calendars and the problems associated with this creation process,Patients and research coordinators at Gillette Center for Women’s cancers,Recommendations were made for a treatment calendar system and software; recommended system was low cost and had to ability to create and save multiple calendars,Treatment schedules for Gillette Center for Women's Cancers,,Health,Women's Cancers
49,Breast Cancer In Thailand: Developing Effective And Accessible Media On Integrative Therapies For Breast Cancer Patients,03-03-11,"Bangkok, Thailand","Bangkok, Thailand",Medical Care| Women--health,https://wpi.primo.exlibrisgroup.com/discovery/fulldisplay?context=L&vid=01WPI_INST:Default&search_scope=studentWorks&tab=https:%2F%2Fwpi.primo.exlibrisgroup.com%2Fpermalink%2F01WPI_INST%2F12krsei%2Falma9936833137204746&docid=alma9936833137204746&lang=en,http://www.wpi.edu/Pubs/E-project/Available/E-project-030311-203732/unrestricted/BBC_FinalReport_March4.pdf,"Davis, Paul W.| deWinter, Jennifer",CS,,https://docs.google.com/document/d/1rxG_hbE2zAtUc8ZNh7DxAvKX715xIT1CKTq3lQMz4M8/edit?usp=sharing,To develop media in the form of a DVD that will educate and inform breast cancer patients about integrative therapies,"Bangkok Breast Cancer Support Group, Queen Sikrit Centre for Breast Cancer, breast cancer patients in Thailand","Created a DVD with nine chapters that introduced yoga and meditation with discussion of their benefits, discussed survivor stories and their experiences with integrative therapies, and provided demonstrations for using yoga and meditation
",Interactive media for breast cancer patients,,Health,Women's Cancers
50,Breast Cancer Information In The Media.,01-01-99,On-campus,"Worcester, MA",Women--health,https://wpi.primo.exlibrisgroup.com/discovery/fulldisplay?context=L&vid=01WPI_INST:Default&search_scope=studentWorks&tab=https:%2F%2Fwpi.primo.exlibrisgroup.com%2Fpermalink%2F01WPI_INST%2F12krsei%2Falma9936832896804746&docid=alma9936832896804746&lang=en,http://ezproxy.wpi.edu/login?url=http://www.wpi.edu/Pubs/E-project/Scanned/99D311I/99D311I.pdf,"Demetry, Chrysanthe",CS,,https://docs.google.com/document/d/1TBuL2uRyMhbVuwt-HBecq84tudee5Yj3SnDlisMkKPU/edit?usp=sharing,To explore the manner in which young women viewed breast cancer information presented by a magazine and a scientific journal; to determine whether women with different educational background would respond differently to these two types of articles,Female students at WPI and Becker College,"Found that the response to two different sources was due to more than just the affiliated school (e.g. scientific literacy, reading abilities, etc.)",Breast cancer information in the media,,Health,Women's Cancers
51,Promoting Awareness And Early Detection Of Breast Cancer In Thailand,03-04-10,"Bangkok, Thailand","Bangkok, Thailand","Websites--design And Construction|education, Higher",https://wpi.primo.exlibrisgroup.com/discovery/fulldisplay?context=L&vid=01WPI_INST:Default&search_scope=studentWorks&tab=https:%2F%2Fwpi.primo.exlibrisgroup.com%2Fpermalink%2F01WPI_INST%2F12krsei%2Falma9936833022004746&docid=alma9936833022004746&lang=en,http://www.wpi.edu/Pubs/E-project/Available/E-project-030410-043448/unrestricted/Breast_Cancer_Awareness_Group_-_Final_IQP_Report.pdf,"Robertson, Thomas B.| Servatius, Brigitte",AN,,https://docs.google.com/document/d/1ASTnUbA2vAFMkyX55TIUNRHeGWqr2OapcnGMSwKgC0w/edit?usp=sharing,"To assist the Bangkok Breast Cancer Support Group and the Queen Sirikit Centre for Breast Cancer develop a brochure, catalogue, and website that provides accurate, accessible, and up-to-date information on breast cancer, as well as to determine strategies for the BBCs and the Centre to further expand the current awareness of breast cancer and breast cancer treatment in Thailand","Bangkok Breast Cancer Support Group, Queen Sirikit Centre for Breast Cancer, breast cancer patients in Thailand","There is a communication gap between Thai medical professionals and the general Thai public about breast cancer and the brochure, catalogue, and website that were developed are potential means for the Queen Sirikit Centre for Breast Cancer and Bangkok Breast Cancer Support Group to mend the communication gap",,,Health,Women's Cancers
