,Title,Date,Project Center,Location,Subject Terms,Link,Alternative Link,Advisors,Initials,Notes,Link to summary,Goal,Stakeholders,Impact,Headline,Follow-up,Category,Sub_Category
83,Competence Vs Legacy: The Employer's Decision,03-10-10,On-campus,"Worcester, MA","Education, Higher|teaching | Women--employment",https://wpi.primo.exlibrisgroup.com/discovery/fulldisplay?context=L&vid=01WPI_INST:Default&search_scope=studentWorks&tab=https:%2F%2Fwpi.primo.exlibrisgroup.com%2Fpermalink%2F01WPI_INST%2F12krsei%2Falma9936832568804746&docid=alma9936832568804746&lang=en,http://www.wpi.edu/Pubs/E-project/Available/E-project-031010-012306/unrestricted/JS8-2091.pdf,"Skorinko, Jeanine L.",CS,Not specifically focused on women- also presents biases due to race and perception of similarity; no recommendations presented,https://docs.google.com/document/d/1POiUv93do67w8wuo3URVySfOXDiq0wZjnQ8Tbidul5o/edit?usp=sharing,"To understand the extent to which perceived similarity due to a shared alma mater, candidate quality, and gender can impact the hiring process","Potential employers, people looking for jobs","Overall, when the candidate was good, male candidates were rated more favorably than females; when the candidate was very good, females were rated more favorably. Biases occurred due to race, gender, and perception of similarity",Gender and hiring decisions,,Business,Employment
84,Does Having A Foreign Accent Affect Men And Women Differently? Effect Of Foreign Accent And Gender On Employment Decisions And Negotiations,4/30/2012,On-campus,"Worcester, MA",Women--employment| Multiculturalism| Equality,https://wpi.primo.exlibrisgroup.com/discovery/fulldisplay?context=L&vid=01WPI_INST:Default&search_scope=studentWorks&tab=https:%2F%2Fwpi.primo.exlibrisgroup.com%2Fpermalink%2F01WPI_INST%2F12krsei%2Falma9936832665704746&docid=alma9936832665704746&lang=en,http://www.wpi.edu/Pubs/E-project/Available/E-project-043012-143024/unrestricted/Accent_Study_Final_Report.pdf,"Skorinko, Jeanine L.",CS,,https://docs.google.com/document/d/1scj9lr0M8yetcBJBC1__jZ3pzRieqjXUrIKQbo2kM2c/edit?usp=sharing,To examine the effect of international accents and gender on hiring and negotiation perceptions,"People looking for jobs, people with accents",Female candidates with a foreign accent are less likely to be hired than female candidates with an American accent,Accent and gender correlation to employment,,Business,Employment
71,Empowering The Women’s Cooperative Of Ban Pang Ung Mhai Through The Competitive Marketing Of Crafts,03-01-13,"Bangkok, Thailand","Bangkok, Thailand",Women--economic Aspects | Women Entrepreneurs,https://wpi.primo.exlibrisgroup.com/discovery/fulldisplay?context=L&vid=01WPI_INST:Default&search_scope=studentWorks&tab=https:%2F%2Fwpi.primo.exlibrisgroup.com%2Fpermalink%2F01WPI_INST%2F12krsei%2Falma9936832964404746&docid=alma9936832964404746&lang=en,http://www.wpi.edu/Pubs/E-project/Available/E-project-030113-031637/unrestricted/ISSP5_Embroidery.pdf,"Selkow, Stanley M.| Tuler, Seth",CS,Product portfolio included in the appendices- lots of photos of products,https://docs.google.com/document/d/1-6psnO1BuWEgMu2EMuYFQtRpVzfdPpnUiHBFS-YV0Pg/edit?usp=sharing,To empower the women’s cooperative in Ban Pang Ung Mhai by promoting skills for improving a marketing strategy in order to establish a more profitable craft business,"Raks Thai Foundation, women of the Cooperative and their families","If the women's marketing knowledge were increased, their business would be more successful (recommendations were made to help with this). Conservation and promotion of culture are important to maintain consumer attraction",Marketing women's crafts in Thailand,,Business,Marketing
72,Exploring Value Adding Initiatives In Rural Northern Greece,05-04-18,"Thessaloniki, Greece","Thessaloniki, Greece",Rural Development|tourism,https://wpi.primo.exlibrisgroup.com/discovery/fulldisplay?context=L&vid=01WPI_INST:Default&search_scope=studentWorks&tab=https:%2F%2Fwpi.primo.exlibrisgroup.com%2Fpermalink%2F01WPI_INST%2F12krsei%2Falma9936833047904746&docid=alma9936833047904746&lang=en,http://www.wpi.edu/Pubs/E-project/Available/E-project-050418-103333/unrestricted/Rural_Final_Draft.pdf,"Bulled, Nicola| Hersh, Robert",CS,"A visually pleasing report, but  the women's cooperative is just a subset of the report",https://docs.google.com/document/d/1I-92afeepsaho0ec6dMU73x3_tH7CRK2HBpSfEd6leM/edit?usp=sharing,"To explore efforts to bring value to a rural region of northern Greece, (Nea Kallikratia and surrounding villages, in Halkidiki and Central Macedonia) with a particular focus on innovative tourism development initiatives","Tourists, Greeks living in rural communities, Greeks in general due to the effect on the economy",Diversification principles and innovative marketing led to the most success,Expanding tourism in Northern Greece,,Business,Marketing
73,Marketing Hand-milled Rice In Thailand: Creating A Self-sustainable Future For The Village Of Mae Khong Khaa,03-11-14,"Bangkok, Thailand","Bangkok, Thailand",Entrepreneurship|marketing|marketing Research,https://wpi.primo.exlibrisgroup.com/discovery/fulldisplay?context=L&vid=01WPI_INST:Default&search_scope=studentWorks&tab=https:%2F%2Fwpi.primo.exlibrisgroup.com%2Fpermalink%2F01WPI_INST%2F12krsei%2Falma9936833011304746&docid=alma9936833011304746&lang=en,http://www.wpi.edu/Pubs/E-project/Available/E-project-031114-201454/unrestricted/Final_Project_IQPSSP5.pdf,"Peet, R. Creighton| Pollice, Gary F.",AN,,https://docs.google.com/document/d/1Vp3miIlqcU8qH795-X__vUIVXk27tCVazUeuW9lcnAo/edit?usp=sharing,"The goal of this project was to provide the Raks Thai Foundation with a marketing plan for the Mae Khong Khaa rice, and to begin to educate the Mae Khong Khaa villagers on the importance of marketing so that they can gain a reliable and better income from the sale of their rice",Villagers of Mae Khong Khaa,"Developed a marketing plan, which included a current product profile, information on how to introduce the product to a specific market, and effective marketing mediums including a marketing brochure and logo",Marketing rice in a community in Thailand,,Business,Marketing
74,"Small Business, Big Impact: A Female-led Microbusiness In Ecuador",3/18/2017,"Cuenca, Ecuador","Cuenca, Ecuador",Women Entrepreneurs,https://wpi.primo.exlibrisgroup.com/discovery/fulldisplay?context=L&vid=01WPI_INST:Default&search_scope=studentWorks&tab=https:%2F%2Fwpi.primo.exlibrisgroup.com%2Fpermalink%2F01WPI_INST%2F12krsei%2Falma9936832969804746&docid=alma9936832969804746&lang=en,http://www.wpi.edu/Pubs/E-project/Available/E-project-031817-141943/unrestricted/HOG_Cuenca_Final_Draft.pdf,"DiBiasio, David| Elgert, Laureen",AN,https://miramecuenca.wordpress.com/,https://docs.google.com/document/d/1JYH2ZgTSEaw_Gw14RzquWjPML8PogNa2yDoTa-syw9Y/edit?usp=sharing,"To aid the Hearts of Gold Foundation in laying the groundwork for the establishment of a female led business in Cuenca, Ecuador","Women in the Azuay province, Hearts of Gold Foundation","Found that jewelry was the optimal choice for a product, 
social enterprise marketing is the best way to market the jewelry to the U.S. and Canada, new business should be established as a compañía limitada (limited liability company), and the startup cost for the new business would be around $144,400- the best way to source initial capital would be to start a crowdfunding campaign
",Supporting marginalized women to start local businesses,,Business,Marketing
75,Uncorking Identity: Exploring Consumer-brand Identification Within The South African Wine Industry,12/14/2017,"Cape Town, South Africa","Cape Town, South Africa",Marketing | Women Entrepreneurs,https://wpi.primo.exlibrisgroup.com/discovery/fulldisplay?context=L&vid=01WPI_INST:Default&search_scope=studentWorks&tab=https:%2F%2Fwpi.primo.exlibrisgroup.com%2Fpermalink%2F01WPI_INST%2F12krsei%2Falma9936833149204746&docid=alma9936833149204746&lang=en,http://www.wpi.edu/Pubs/E-project/Available/E-project-121417-094228/unrestricted/WIW_Final_IQP_Report_B17.pdf,"Bulled, Nicola| Skorinko, Jeanine L.",AN,Report has lots of visuals,https://docs.google.com/document/d/16KliaMj4GcR-g7bHnovvxe5VVX4VTXw9VQIhgkVfBWg/edit?usp=sharing,"To explore the issues of identity with regards to wine consumption in an effort to inform new producers, like our sponsor Women and Wine, how they might consider future brand imagery","Underrepresented groups in wine making industry, Women in Wine","Found that four key drivers predict consumer-brand identification within the wine industry: brand prestige, brand social benefits, brand distinctiveness, and brand warmth",Exploring consumer-brand identification for the wine industry in South Africa,,Business,Marketing
76,Exploring Market Opportunities For Women In Wine In The South African And Global Wine Industries,12-10-16,"Cape Town, South Africa","Cape Town, South Africa",Women Entrepreneurs|entrepreneurship,https://wpi.primo.exlibrisgroup.com/discovery/fulldisplay?context=L&vid=01WPI_INST:Default&search_scope=studentWorks&tab=https:%2F%2Fwpi.primo.exlibrisgroup.com%2Fpermalink%2F01WPI_INST%2F12krsei%2Falma9936833163504746&docid=alma9936833163504746&lang=en,http://www.wpi.edu/Pubs/E-project/Available/E-project-121016-150033/unrestricted/Mission_in_a_Bottle.pdf,"Agloro, Alexandrina R.| Bulled, Nicola",CS,Visually pleasing report,https://docs.google.com/document/d/1G9AwaZERfXRKFvgbVBV7A7hguL4ZT1mrR_MXMMsEAFE/edit?usp=sharing,"To help Women in Wine identify strategies for domestic and international expansion by assessing its’ products placement in the market, as influenced by the company’s progressive social and environmental sustainability mission",Women in Wine,"Found that taste and quality are the most important aspects of a wine according to consumers, retailers, and industry professionals",Expanding Women in Wine in South Africa,,Business,Marketing
77,I Am Dress For Success Worcester: A Video Campaign,Apr-19,Worcester Community Project Center,"Worcester, MA",Women--employment,https://wpi.primo.exlibrisgroup.com/discovery/fulldisplay?context=L&vid=01WPI_INST:Default&search_scope=studentWorks&tab=https:%2F%2Fwpi.primo.exlibrisgroup.com%2Fpermalink%2F01WPI_INST%2F12krsei%2Falma9936880962104746&docid=alma9936880962104746&lang=en,https://digitalcommons.wpi.edu/cgi/viewcontent.cgi?article=6392&context=iqp-all,"Krueger, Robert | Roberts, Laura",CS,Visually pleasing report,https://docs.google.com/document/d/1mhjpl0K7B_yYiP8Wt-eQI_wc0nr6FHalavkJi5R6_JE/edit?usp=sharing,To create marketing materials to help Dress for Success Worcester promote their range of services,"Women seeking jobs in Worcester, Dress for Success Worcester","6 videos developed- The Suiting Program, The Financial Literacy Program, The Workplace Readiness Program (I Am Successful Program), The Career Center Program, and The Professional Women’s Group",Promotion of Dress for Success Worcester,,Business,Marketing
85,Plastic Waste Pollution And Mosquito Control In Bangkok Slums -- An Educational Approach,Jan-99,"Bangkok, Thailand","Bangkok, Thailand","Recycling (waste, Etc.) | Plastics | Women In Development",https://wpi.primo.exlibrisgroup.com/discovery/fulldisplay?context=L&vid=01WPI_INST:Default&search_scope=studentWorks&tab=https:%2F%2Fwpi.primo.exlibrisgroup.com%2Fpermalink%2F01WPI_INST%2F12krsei%2Falma9936832936404746&docid=alma9936832936404746&lang=en,https://digitalcommons.wpi.edu/cgi/viewcontent.cgi?article=4964&context=iqp-all,"Lemone, Karen | Vaz, Richard F.",CS,"Not much of an analysis on teaching the women's craft group how to weave with plastic bags, just the children's educational program",https://docs.google.com/document/d/1IGv5L3CBiytOW5E_rqzAEPi-z4RuMmqaAFmqGth85Bo/edit?usp=sharing,to help prevent plastic pollution by teaching women’s craft groups how to use plastics in weaving and spread awareness about plastic pollution to preschoolers,"Human Development Center (HDC), preschoolers and women’s craft groups in Bangkok",Createde a puppet show for preschoolers and a plastic weaving demonstration for craft groups,"Weaving with plastic bags in women's craft groups, Bangkok",,Business,No Sub-Category
86,A Radical Feminist Critique Of The Video Game Industry,4/28/2016,On-campus,"Worcester, MA",Video Games |women--social Conditions,https://wpi.primo.exlibrisgroup.com/discovery/fulldisplay?context=L&vid=01WPI_INST:Default&search_scope=studentWorks&tab=https:%2F%2Fwpi.primo.exlibrisgroup.com%2Fpermalink%2F01WPI_INST%2F12krsei%2Falma9936832860104746&docid=alma9936832860104746&lang=en,http://www.wpi.edu/Pubs/E-project/Available/E-project-042816-115843/unrestricted/badumas_IQP.pdf,"Sanbonmatsu, John",CS,More of a research paper- not really any recommendations given,https://docs.google.com/document/d/1lrnmbASGfomeVBDKQLUlPTVlafx0kHmV6-x4VqfY_zs/edit?usp=sharing,To discuss the objectification of women in video games,"Video game industry, people who play video games","Reveals how societal values are reflected in the video game industry through the various tropes of female characters in video games (damsel in distress, ""Ms. Male character,"" sexual objectification of females)",A Radical Feminist Critique of the Video Games Industry,,Business,No Sub-Category
87,The Mix Of Media And Decadence,08-05-04,On-campus,"Worcester, MA",Equality | Women,https://wpi.primo.exlibrisgroup.com/discovery/fulldisplay?context=L&vid=01WPI_INST:Default&search_scope=studentWorks&tab=https:%2F%2Fwpi.primo.exlibrisgroup.com%2Fpermalink%2F01WPI_INST%2F12krsei%2Falma9936832790304746&docid=alma9936832790304746&lang=en,http://ezproxy.wpi.edu/login?url=http://www.wpi.edu/Pubs/E-project/Scanned/06E004I.pdf,"Quinn, Patrick J.",AN,Research paper- no recommendations provided,https://docs.google.com/document/d/1Nc_T6FmqZVb3PaIqUmwHmfbY0qJ6oClY2xt4-eBe8uA/edit?usp=sharing,"Follows the history of burlesque, pinups, and striptease as it establishes her ascendance in advertising and third-wave feminism as a key element in public discourse",,Follows the history of femme fatale in American pop culture,"Burlesque, pinups, striptease, and feminism in public discourse",,Business,No Sub-Category
78,Internet Privacy: Public Perceptions Of Security And Convenience,Feb-12,On-campus,"Worcester, MA",Human-computer Interaction,https://wpi.primo.exlibrisgroup.com/discovery/fulldisplay?context=L&vid=01WPI_INST:Default&search_scope=studentWorks&tab=https:%2F%2Fwpi.primo.exlibrisgroup.com%2Fpermalink%2F01WPI_INST%2F12krsei%2Falma9936832669004746&docid=alma9936832669004746&lang=en,https://digitalcommons.wpi.edu/cgi/viewcontent.cgi?article=3044&context=iqp-all,"Rissmiller, Kent J.",CS,Gender was just one component of the analysis,https://docs.google.com/document/d/1_V7PN2G9CYzZX8Q1aGCt1D9w1yrIpmVcOwgWkFIOyxs/edit?usp=sharing,"To determine how Internet users’ educational background, gender, and amount of time spent online affect their preference for privacy or convenience within the services of social networking, e-commerce, and online banking",People who use the internet,"Results included: non-WPI students ranked themselves higher in knowledge about internet privacy than WPI students, males believed they were more knowledgeable about internet privacy than females, males believed they were more knowledgeable than females about protecting themselves from online threats, more females valued privacy over convenience
",Gender and internet privacy,,Business,Technology
79,Website Development For Association Solidarité Féminine,10-12-16,"Rabat, Morocco","Rabat, Morocco",Websites--design And Construction | Women In Development | Women--social Conditions,https://wpi.primo.exlibrisgroup.com/discovery/fulldisplay?context=L&vid=01WPI_INST:Default&search_scope=studentWorks&tab=https:%2F%2Fwpi.primo.exlibrisgroup.com%2Fpermalink%2F01WPI_INST%2F12krsei%2Falma9936833127904746&docid=alma9936833127904746&lang=en,http://www.wpi.edu/Pubs/E-project/Available/E-project-101216-072347/unrestricted/Wesbite_Development_ASF_IQP_Report.pdf,"Shockey, Ingrid K.| Somasse, Gbetonmasse B.",AN,Lots of visuals in the report,https://docs.google.com/document/d/121Nj8VrLb2R0h1YTCW8_1hWlJLq31xnzblwy9ZjokXc/edit?usp=sharing,"To create a website for the Association Solidarité Féminine organization (ASF) by understanding the mission, outreach, the client base, and the constituents",Association Solidarité Féminine,Developed a website template for the Association (located at https://solfem.wordpress.com/),Website development for org supporting single moms,,Business,Technology
80,"Women Weavers Of Ain Leuh, Morocco: Use Of Internet Technology & Global Marketing",10/28/2008,"Rabat, Morocco","Ain Leuh, Morocco",Women--effect Of Technological Innovations On | Equality | Community Development,https://wpi.primo.exlibrisgroup.com/discovery/fulldisplay?context=L&vid=01WPI_INST:Default&search_scope=studentWorks&tab=https:%2F%2Fwpi.primo.exlibrisgroup.com%2Fpermalink%2F01WPI_INST%2F12krsei%2Falma9936832995004746&docid=alma9936832995004746&lang=en,http://www.wpi.edu/Pubs/E-project/Available/E-project-102808-144001/unrestricted/WomenWeaversInAinLeuh[1].pdf,"Addison, W. A.| El-Korchi, Tahar",AN,,https://docs.google.com/document/d/1ey7MsrFMOoA9sctLgrZMf0YFvtZPEuPoAoUba4UET4w/edit?usp=sharing,"To create a website for the women of the Cooperative des Tisseuses d’Ain Leuh, which is located in Ain Leuh, Morocco",Cooperative des Tisseuses d’Ain Leuh,A website was constructed for The Cooperative des Tisseuses d’Ain Leuh,Website development for weavers in Morocco,,Business,Technology
81,Women's Environmental Network: Improving An Internet Presence,6/25/2009,"London, England","London, England",Women | Interactive Multimedia | Websites--design And Construction,https://wpi.primo.exlibrisgroup.com/discovery/fulldisplay?context=L&vid=01WPI_INST:Default&search_scope=studentWorks&tab=https:%2F%2Fwpi.primo.exlibrisgroup.com%2Fpermalink%2F01WPI_INST%2F12krsei%2Falma9936832970304746&docid=alma9936832970304746&lang=en,http://www.wpi.edu/Pubs/E-project/Available/E-project-062509-125010/unrestricted/WomensEnvironmentalNetwork_IQP_E09.pdf,"Elmes, Michael B.| Higgins, Lorraine D.",AN,,https://docs.google.com/document/d/1qnQEZ561eAC8QsRQaQf7XLo-8RnbV97ZUyetHOpsWr8/edit?usp=sharing,To determine how to achieve the most effective internet presence and to educate the Women's Environmental Network on these findings,Women's Environmental Network,"Developed a Facebook page, prototype designs for an updated website, and recommendations for future maintenance and improvement",Website development for women's environmental org in England,,Business,Technology
82,Technology In Service Of The Poor: An Assessment Of A Unique Poverty Diagnostic Tool And Its Implementation In Paraguay,9/17/2014,"Asunción, Paraguay","Asunción, Paraguay",Women--economic Aspects | Women Entrepreneurs | Women In Development,https://wpi.primo.exlibrisgroup.com/discovery/fulldisplay?context=L&vid=01WPI_INST:Default&search_scope=studentWorks&tab=https:%2F%2Fwpi.primo.exlibrisgroup.com%2Fpermalink%2F01WPI_INST%2F12krsei%2Falma9936833126804746&docid=alma9936833126804746&lang=en,http://www.wpi.edu/Pubs/E-project/Available/E-project-091714-101414/unrestricted/Paraneers.pdf,"Traver, Robert W.",AN,,https://docs.google.com/document/d/1IsyVJUts1OtsnKfsf2BHzdLdfwvTp83CknLfcd74kVg/edit?usp=sharing,To improve the monitoring system in place for tracking income poverty in the Poverty Stoplight Program developed by Fundacion Paraguaya,"Fundación Paraguaya, people benefitting from the Poverty Stoplight Program",Provided recommendations to improve the Poverty Stoplight Program from a management perspective,Women and the Poverty Stoplight Program - Paraguay,,Business,Technology
88,Worcester Women's Oral History Project,01-01-06,On-campus,"Worcester, MA",Women | Historic Preservation | Museum Exhibits,https://wpi.primo.exlibrisgroup.com/discovery/fulldisplay?context=L&vid=01WPI_INST:Default&search_scope=studentWorks&tab=https:%2F%2Fwpi.primo.exlibrisgroup.com%2Fpermalink%2F01WPI_INST%2F12krsei%2Falma9936832781204746&docid=alma9936832781204746&lang=en,https://web.wpi.edu/Pubs/E-project/Scanned/06B016I/06B016I.pdf,"Demetry, James S.",AN,,https://docs.google.com/document/d/1qz48TW7p7UuMk2bPDfIzMRnDX_gvyQuJ2lmUnU-o6Oo/edit?usp=sharing,To investigate the feasibility of creating a permanent site of women’s oral history at the new Worcester Visitor Center,"Worcester Visitor Center, Worcester community",Designed a directory and offered recommendations to enable a feasible implementation of the site; designed a database to store oral interviews,Worcester women's oral history project,,Cultural,No Sub-Category
89,Insurance Versus Gambling -- How Context Affects Risk-taking Behavior.,Jan-99,On-campus,"Worcester, MA",Risk Management,https://wpi.primo.exlibrisgroup.com/discovery/fulldisplay?context=L&vid=01WPI_INST:Default&search_scope=studentWorks&tab=https:%2F%2Fwpi.primo.exlibrisgroup.com%2Fpermalink%2F01WPI_INST%2F12krsei%2Falma9936832776504746&docid=alma9936832776504746&lang=en,https://digitalcommons.wpi.edu/cgi/viewcontent.cgi?article=5594&context=iqp-all ,"Rulnick, John M.",CS,Gender is a significant predictor of risk taking,https://docs.google.com/document/d/1oNZ88gLewIjzuTJ7qjLfJagxbUbNfQlvXGgVwaYFfHk/edit?usp=sharing,To determine if context of gambling versus insurance is one of the major determining factors in risky decision making,People who take risks,Females appeared to be more risk-averse than males,Gender as a predictor of risk taking,,Cultural,No Sub-Category
90,Art Culture And Fractal Dimension,08-08-16,On-campus,"Worcester, MA",Mathematical Models,https://digitalcommons.wpi.edu/iqp-all/5371/,https://web.wpi.edu/Pubs/E-project/Available/E-project-081116-152754/unrestricted/Report-2.pdf,"Humi, Mayer",AN,explores difference between male and female painters; only one aspect of report,https://docs.google.com/document/d/1qj5EC1cfhNXkaPKQ8cQmCyg7f_QHFuI9w1JOOcxAD-Y/edit?usp=sharing,To explore the relationships between fractal dimension and aesthetic painting analysis,,Fractal dimension of these paintings is correlated closely with the artist career and the prevailing culture,Gender differences in art culture and fractal dimension,,Cultural,No Sub-Category
91,The Xhubleta: A Woman's Perspective,12/14/2018,"Tirana, Albania","Tirana, Albania",Women--social Conditions,https://wpi.primo.exlibrisgroup.com/discovery/fulldisplay?context=L&vid=01WPI_INST:Default&search_scope=studentWorks&tab=https:%2F%2Fwpi.primo.exlibrisgroup.com%2Fpermalink%2F01WPI_INST%2F12krsei%2Falma9936895943604746&docid=alma9936895943604746&lang=en,http://www.wpi.edu/Pubs/E-project/Available/E-project-121418-085048/unrestricted/XhubletaBook.pdf,"Dodson, Leslie L.| Hersh, Robert",AN,Visually pleasing report,https://docs.google.com/document/d/13XejBnoEziFFCCokvnt71Wi5-8KshN1NXkl8yiLUY6I/edit?usp=sharing,"To understand and document the changing experience of women in northern Albania over the past century, using a traditional costume, the xhubleta, as a lens to see into their lives","GO2 Albania, women in Albania","Found contradictions surrounding the various cultural meanings assigned to the dress, with women’s subjugation under patriarchal customs co-existing with women’s pride in wearing it;
the dress is seen as an object, unattached to the lives of the wearers., which is very different from the ways the xhubleta was seen in the past
",Women's perspective on Albanian traditional dress,,Cultural,No Sub-Category
92,College Perceptions Of Instant Messaging -- A Technology Fluxus,Jan-07,On-campus,"Worcester, MA",Human-computer Interaction,https://wpi.primo.exlibrisgroup.com/discovery/fulldisplay?context=L&vid=01WPI_INST:Default&search_scope=studentWorks&tab=https:%2F%2Fwpi.primo.exlibrisgroup.com%2Fpermalink%2F01WPI_INST%2F12krsei%2Falma9936832815704746&docid=alma9936832815704746&lang=en,https://digitalcommons.wpi.edu/cgi/viewcontent.cgi?article=4734&context=iqp-all,"Taylor, Steven S.",CS,"Interview transcripts had mentions of how women tend to get more offended than men if a miscommunication arises, but there was no mention of women otherwise",https://docs.google.com/document/d/1UIpfPW4phL6bnVnYddvYAEihBl8T9xRn2jDXaLY-nA0/edit?usp=sharing,To capture and share college-age students’ perceptions of instant messaging,"College students, people who use IM","Common themes from interviews were personal IM history, benefits of IM, relationships, and communication",,,Cultural,No Sub-Category
93,The Effect Of An Educational Video On The Acceptance Of Nanotechnology,Feb-08,On-campus,"Worcester, MA",Science--study And Teaching,https://wpi.primo.exlibrisgroup.com/discovery/fulldisplay?context=L&vid=01WPI_INST:Default&search_scope=studentWorks&tab=https:%2F%2Fwpi.primo.exlibrisgroup.com%2Fpermalink%2F01WPI_INST%2F12krsei%2Falma9936832614504746&docid=alma9936832614504746&lang=en,https://digitalcommons.wpi.edu/cgi/viewcontent.cgi?article=2323&context=iqp-all,"Burnham, Nancy A.",CS,"More focused on overall results, but examined them based on gender as well; lots of figures in the report",https://docs.google.com/document/d/1GIgXCzqVk2lJKPwLBqnPe3CLAyf3OVWRLXo9p8J83Xg/edit?usp=sharing,To examine the effect of education about nanotechnology on acceptance,People who develop/use nanotechnology (focusing on college students),Found that girls consider mathematics more difficult and have a much more negative opinion of the subject,,,Cultural,No Sub-Category
